<?xml version="1.0" encoding="UTF-8" standalone="no"?>
<xs:schema elementFormDefault="qualified" targetNamespace="http://earthdawn.com/discipline" xmlns="http://earthdawn.com/discipline" xmlns:xs="http://www.w3.org/2001/XMLSchema" xmlns:edt="http://earthdawn.com/datatypes">
	<xs:import namespace="http://earthdawn.com/datatypes" schemaLocation="earthdawndatatypes.xsd"/>
	<xs:complexType name="DISCIPLINEDURABILITY_type">
		<xs:attribute name="value" type="edt:unsigned_int" default="0"/>
		<xs:attribute name="death" type="edt:unsigned_int" default="0"/>
		<xs:attribute name="unconsciousness" type="edt:unsigned_int" default="0"/>
		<xs:attribute name="circle" type="edt:unsigned_int" default="0"/>
	</xs:complexType>
	<xs:complexType name="DISCIPLINESPELL_type">
		<xs:attribute name="name" type="xs:string" use="required"/>
		<xs:attribute name="type" type="edt:spellkind_type" use="required"/>
	</xs:complexType>
	<xs:complexType name="FOREIGNTALENTS_type">
		<xs:attribute name="maxcircle" type="edt:circle_type" default="1"/>
		<xs:attribute name="mincircle" type="edt:circle_type" default="1"/>
	</xs:complexType>
	<xs:complexType name="DISCIPLINECIRCLE_type">
		<xs:sequence maxOccurs="1" minOccurs="1">
			<xs:element minOccurs="0" maxOccurs="1" name="FOREIGNTALENTS" type="FOREIGNTALENTS_type"/>
			<xs:element minOccurs="0" maxOccurs="unbounded" name="OPTIONALTALENT" type="edt:TALENTABILITY_type"/>
			<xs:element minOccurs="0" maxOccurs="unbounded" name="FREETALENT" type="edt:TALENTABILITY_type"/>
			<xs:element minOccurs="0" maxOccurs="8" name="DISCIPLINETALENT" type="edt:TALENTABILITY_type"/>
			<xs:element minOccurs="1" maxOccurs="1" name="TALENTABILITY" type="edt:DISZIPINABILITY_type"/>
			<xs:element minOccurs="0" maxOccurs="unbounded" name="SPELL" type="DISCIPLINESPELL_type"/>
			<xs:element minOccurs="0" maxOccurs="unbounded" name="SPELLABILITY" type="edt:DISZIPINABILITY_type"/>
			<xs:element minOccurs="0" maxOccurs="unbounded" name="DEFENSE" type="edt:DEFENSEABILITY_type"/>
			<xs:element minOccurs="0" maxOccurs="unbounded" name="ARMOR" type="edt:ARMOR_type"/>
			<xs:element minOccurs="0" maxOccurs="unbounded" name="INITIATIVE" type="edt:DISZIPINABILITY_type"/>
			<xs:element minOccurs="0" maxOccurs="unbounded" name="RECOVERYTESTPERDAY" type="edt:DISZIPINABILITY_type"/>
			<xs:element minOccurs="0" maxOccurs="unbounded" name="RECOVERYTESTSTEP" type="edt:DISZIPINABILITY_type"/>
			<xs:element minOccurs="0" maxOccurs="unbounded" name="KARMA" type="edt:KARMAABILITY_type"/>
			<xs:element minOccurs="0" maxOccurs="unbounded" name="KARMASTEP" type="edt:DISZIPINABILITY_type"/>
			<xs:element minOccurs="0" maxOccurs="unbounded" name="ABILITY" type="xs:string"/>
		</xs:sequence>
	</xs:complexType>
	<xs:element name="DISCIPLINE">
		<xs:complexType>
			<xs:sequence maxOccurs="1" minOccurs="1">
				<xs:element minOccurs="1" maxOccurs="1" name="DURABILITY" type="DISCIPLINEDURABILITY_type"/>
				<xs:element minOccurs="0" maxOccurs="unbounded" name="EASYSKILL" type="xs:string"/>
				<xs:element minOccurs="8" maxOccurs="15" name="CIRCLE" type="DISCIPLINECIRCLE_type"/>
				<xs:element minOccurs="0" maxOccurs="1" name="KARMARITUAL" type="xs:string"/>
				<xs:element minOccurs="0" maxOccurs="1" name="HALFMAGIC" type="xs:string"/>
			</xs:sequence>
			<xs:attribute name="lang" type="edt:language_type" use="required"/>
			<xs:attribute name="name" type="xs:string" use="required"/>
			<xs:attribute name="bookref" type="xs:string" default=""/>
			<xs:attribute name="rulesetversion" type="edt:rulesetversion_type" default="ED3"/>
		</xs:complexType>
	</xs:element>
</xs:schema>
