<?xml version="1.0" encoding="UTF-8" standalone="no"?>
<DISCIPLINE name="Wind Scout" lang="en" bookref="NG p.209" xmlns="http://earthdawn.com/discipline" xmlns:xsi="http://www.w3.org/2001/XMLSchema-instance" xmlns:edt="http://earthdawn.com/datatypes" xsi:schemaLocation="http://earthdawn.com/discipline ../../earthdawndiscipline.xsd">
	<DURABILITY death="6" unconsciousness="5"/>
	<CIRCLE><!-- 1 -->
		<OPTIONALTALENT name="Navigation"/>
		<OPTIONALTALENT name="Sprint"/>
		<OPTIONALTALENT name="Melee Weapons"/>
		<OPTIONALTALENT name="Missile Weapons"/>
		<OPTIONALTALENT name="Silent Walk"/>
		<DISCIPLINETALENT name="Avoid Blow"/>
		<DISCIPLINETALENT name="Karma Ritual"/>
		<DISCIPLINETALENT name="Evidence Analysis"/>
		<DISCIPLINETALENT name="Tracking"/>
		<DISCIPLINETALENT name="Wilderness Survival"/>
		<TALENTABILITY/>
	</CIRCLE>
	<CIRCLE><!-- 2 -->
		<OPTIONALTALENT name="Anticipate Blow"/>
		<OPTIONALTALENT name="Detect Trap"/>
		<OPTIONALTALENT name="Speak Language"/>
		<OPTIONALTALENT name="Creature Analysis"/>
		<OPTIONALTALENT name="Durability"/>
		<OPTIONALTALENT name="Throwing Weapons"/>
		<OPTIONALTALENT name="Animal Bond"/>
		<OPTIONALTALENT name="Lifesight"/>
		<DISCIPLINETALENT name="Search"/>
		<TALENTABILITY/>
		<DEFENSE kind="physical"/>
	</CIRCLE>
	<CIRCLE><!-- 3 -->
		<DISCIPLINETALENT name="Scent Identifier"/>
		<TALENTABILITY/>
	</CIRCLE>
	<CIRCLE><!-- 4 -->
		<DISCIPLINETALENT name="Thread Weaving" limitation="Scent Weaving"/>
		<TALENTABILITY/>
		<KARMA spend="Perception-only Test"/>
	</CIRCLE>
	<CIRCLE><!-- 5 -->
		<OPTIONALTALENT name="Mystic Aim"/>
		<OPTIONALTALENT name="Direction Arrow"/>
		<OPTIONALTALENT name="Disarm Trap"/>
		<OPTIONALTALENT name="Spot Armor Flaw"/>
		<OPTIONALTALENT name="Surprise Strike"/>
		<OPTIONALTALENT name="Sense Danger"/>
		<OPTIONALTALENT name="Wind Dance"/>
		<OPTIONALTALENT name="Wound Balance"/>
		<DISCIPLINETALENT name="Bird Song"/>
		<TALENTABILITY/>
		<ABILITY>Step Outside</ABILITY>
	</CIRCLE>
	<CIRCLE><!-- 6 -->
		<DISCIPLINETALENT name="Endure Cold"/>
		<TALENTABILITY/>
		<KARMA spend="Dexterity-only Test"/>
	</CIRCLE>
	<CIRCLE><!-- 7 -->
		<DISCIPLINETALENT name="Sense Poison"/>
		<TALENTABILITY/>
		<KARMA spend="gather information by Smell Test"/>
	</CIRCLE>
	<CIRCLE><!-- 8 -->
		<DISCIPLINETALENT name="Safe Path"/>
		<TALENTABILITY/>
		<DEFENSE kind="physical"/>
	</CIRCLE>
	<CIRCLE><!-- 9 -->
		<OPTIONALTALENT name="Air Dance"/>
		<OPTIONALTALENT name="Animal Possession"/>
		<OPTIONALTALENT name="Bestial Resilience"/>
		<OPTIONALTALENT name="Bestial Toughness"/>
		<OPTIONALTALENT name="Dive Attack"/>
		<OPTIONALTALENT name="Life Check"/>
		<OPTIONALTALENT name="Lion Heart"/>
		<OPTIONALTALENT name="Thought Link"/>
		<DISCIPLINETALENT name="True Sight"/>
		<TALENTABILITY/>
		<KARMA spend="Recovery Test"/>
		<ABILITY>Reconnaissance</ABILITY>
	</CIRCLE>
	<CIRCLE><!-- 10 -->
		<DISCIPLINETALENT name="Chameleon"/>
		<TALENTABILITY/>
		<DEFENSE kind="physical"/>
		<RECOVERYTESTPERDAY/>
	</CIRCLE>
	<CIRCLE><!-- 11 -->
		<DISCIPLINETALENT name="Plant Shelter"/>
		<TALENTABILITY/>
		<DEFENSE kind="mystic"/>
		<DEFENSE kind="social"/>
	</CIRCLE>
	<CIRCLE><!-- 12 -->
		<DISCIPLINETALENT name="Defense"/>
		<TALENTABILITY/>
		<DEFENSE kind="physical"/>
		<INITIATIVE/>
	</CIRCLE>
	<CIRCLE><!-- 13 -->
		<OPTIONALTALENT name="Elemental Walk"/>
		<OPTIONALTALENT name="Ethereal Weapon"/>
		<OPTIONALTALENT name="Missile Twister"/>
		<OPTIONALTALENT name="Multi-Tongue"/>
		<OPTIONALTALENT name="Netherwalk"/>
		<OPTIONALTALENT name="Show Armor Flaw"/>
		<DISCIPLINETALENT name="Echo Location"/>
		<TALENTABILITY/>
		<DEFENSE kind="mystic"/>
		<KARMASTEP/>
		<ABILITY>Wing Mastery</ABILITY>
	</CIRCLE>
	<CIRCLE><!-- 14 -->
		<DISCIPLINETALENT name="Second Chance"/>
		<TALENTABILITY/>
		<DEFENSE kind="physical"/>
		<INITIATIVE/>
		<RECOVERYTESTPERDAY/>
	</CIRCLE>
	<CIRCLE><!-- 15 -->
		<DISCIPLINETALENT name="Develop Animal Sense"/>
		<TALENTABILITY/>
		<DEFENSE kind="mystic"/>
		<DEFENSE kind="social"/>
		<INITIATIVE/>
	</CIRCLE>
	<KARMARITUAL>Please insert a short description of your Karma Ritual. It have to last for 30 minutes</KARMARITUAL>
	<HALFMAGIC>recognize scents, tracks, trails left by animals, plants, Namegivers in wilderness environments; Skill: Search, Detect Trap, Navigation; (NG p.211)</HALFMAGIC>
</DISCIPLINE>
