<?xml version="1.0" encoding="UTF-8" standalone="no"?>
<DISCIPLINE name="Beastlord" lang="en" bookref="CPG p.26" xmlns="http://earthdawn.com/discipline" xmlns:xsi="http://www.w3.org/2001/XMLSchema-instance" xmlns:edt="http://earthdawn.com/datatypes" xsi:schemaLocation="http://earthdawn.com/discipline ../../earthdawndiscipline.xsd">
	<DURABILITY death="6" unconsciousness="5"/>
	<CIRCLE><!-- 1 -->
		<OPTIONALTALENT name="First Impression"/>
		<OPTIONALTALENT name="Melee Weapons"/>
		<OPTIONALTALENT name="Tracking"/>
		<OPTIONALTALENT name="Unarmed Combat"/>
		<OPTIONALTALENT name="Wilderness Survival"/>
		<DISCIPLINETALENT name="Creature Analysis"/>
		<DISCIPLINETALENT name="Karma Ritual"/>
		<DISCIPLINETALENT name="Manifest Beast"/>
		<DISCIPLINETALENT name="Past Tongues"/>
		<DISCIPLINETALENT name="Sense Animals"/>
		<TALENTABILITY/>
	</CIRCLE>
	<CIRCLE><!-- 2 -->
		<OPTIONALTALENT name="Animal Training"/>
		<OPTIONALTALENT name="Avoid Blow"/>
		<OPTIONALTALENT name="Durability"/>
		<OPTIONALTALENT name="Frighten Animals"/>
		<OPTIONALTALENT name="Haggle"/>
		<OPTIONALTALENT name="Heartening Laugh"/>
		<OPTIONALTALENT name="Sense Danger"/>
		<OPTIONALTALENT name="Silent Walk"/>
		<DISCIPLINETALENT name="Calm Beast"/>
		<TALENTABILITY/>
		<DEFENSE kind="social"/>
	</CIRCLE>
	<CIRCLE><!-- 3 -->
		<DISCIPLINETALENT name="Empathic Sense"/>
		<TALENTABILITY/>
	</CIRCLE>
	<CIRCLE><!-- 4 -->
		<DISCIPLINETALENT name="Thread Weaving" limitation="Way Weaving"/>
		<TALENTABILITY/>
		<KARMA spend="Charisma-only Test"/>
	</CIRCLE>
	<CIRCLE><!-- 5 -->
		<OPTIONALTALENT name="Anticipate Blow"/>
		<OPTIONALTALENT name="Blood Share"/>
		<OPTIONALTALENT name="Hypnotize"/>
		<OPTIONALTALENT name="Leadership"/>
		<OPTIONALTALENT name="Lion Heart"/>
		<OPTIONALTALENT name="Poison Resistance"/>
		<OPTIONALTALENT name="Taunt"/>
		<OPTIONALTALENT name="Tiger Spring"/>
		<DISCIPLINETALENT name="Beast Summons"/>
		<TALENTABILITY/>
		<ABILITY>Sense Motive</ABILITY>
	</CIRCLE>
	<CIRCLE><!-- 6 -->
		<DISCIPLINETALENT name="Resist Taunt"/>
		<TALENTABILITY/>
		<KARMA spend="Perception-only Test"/>
	</CIRCLE>
	<CIRCLE><!-- 7 -->
		<DISCIPLINETALENT name="Animal Slumber"/>
		<TALENTABILITY/>
		<KARMA spend="Action Tests made by one of his manifested or tasked animals"/>
	</CIRCLE>
	<CIRCLE><!-- 8 -->
		<DISCIPLINETALENT name="Inherited Powers"/>
		<TALENTABILITY/>
		<DEFENSE kind="social"/>
	</CIRCLE>
	<CIRCLE><!-- 9 -->
		<OPTIONALTALENT name="Animal Leadership"/>
		<OPTIONALTALENT name="Bestial Toughness"/>
		<OPTIONALTALENT name="Endure Cold"/>
		<OPTIONALTALENT name="Frenzy"/>
		<OPTIONALTALENT name="Incite Mob"/>
		<OPTIONALTALENT name="Incite Stampede"/>
		<OPTIONALTALENT name="Tame Mount"/>
		<OPTIONALTALENT name="Thought Link"/>
		<DISCIPLINETALENT name="Task Kin"/>
		<TALENTABILITY/>
		<KARMA spend="Recovery Test"/>
		<ABILITY>True Self</ABILITY>
	</CIRCLE>
	<CIRCLE><!-- 10 -->
		<DISCIPLINETALENT name="Detect Falsehood"/>
		<TALENTABILITY/>
		<DEFENSE kind="social"/>
		<RECOVERYTESTPERDAY/>
	</CIRCLE>
	<CIRCLE><!-- 11 -->
		<DISCIPLINETALENT name="Howl"/>
		<TALENTABILITY/>
		<DEFENSE kind="mystic"/>
		<DEFENSE kind="physical"/>
		<RECOVERYTESTPERDAY/>
	</CIRCLE>
	<CIRCLE><!-- 12 -->
		<DISCIPLINETALENT name="Develop Animal Sense"/>
		<TALENTABILITY/>
		<DEFENSE kind="social"/>
		<KARMA spend="Willpower-only Test"/>
	</CIRCLE>
	<CIRCLE><!-- 13 -->
		<OPTIONALTALENT name="Aura Armor"/>
		<OPTIONALTALENT name="Bestial Resilience"/>
		<OPTIONALTALENT name="Lion Spirit"/>
		<OPTIONALTALENT name="Scent Identifier"/>
		<OPTIONALTALENT name="Second Chance"/>
		<OPTIONALTALENT name="True Sight"/>
		<DISCIPLINETALENT name="Bardic Voice"/>
		<TALENTABILITY/>
		<DEFENSE kind="mystic"/>
		<KARMASTEP/>
		<ABILITY>True Strength</ABILITY>
	</CIRCLE>
	<CIRCLE><!-- 14 -->
		<DISCIPLINETALENT name="Chameleon"/>
		<TALENTABILITY/>
		<DEFENSE kind="social"/>
		<RECOVERYTESTPERDAY/>
	</CIRCLE>
	<CIRCLE><!-- 15 -->
		<DISCIPLINETALENT name="Spirit Blend"/>
		<TALENTABILITY/>
		<DEFENSE kind="mystic"/>
		<DEFENSE kind="physical"/>
		<INITIATIVE/>
	</CIRCLE>
	<KARMARITUAL>Please insert a short description of your Karma Ritual. It have to last for 30 minutes</KARMARITUAL>
	<HALFMAGIC>knowledge: animalâ€™s behaviour, character, likely reactions in situations, (not physical traits); Skill: Wilderness Survival; intuition strengthened by half-magic; for Interaction (Insight) Tests; recognize Animal Selves important to other Beastlords;(CPG p.28)</HALFMAGIC>
</DISCIPLINE>

