<?xml version="1.0" encoding="UTF-8" standalone="no"?>
<DISCIPLINE name="Dieb" lang="de" rulesetversion="ED4" xmlns="http://earthdawn.com/discipline" xmlns:xsi="http://www.w3.org/2001/XMLSchema-instance" xmlns:edt="http://earthdawn.com/datatypes" xsi:schemaLocation="http://earthdawn.com/discipline ../../earthdawndiscipline.xsd">
	<DURABILITY value="5" circle="1"/>
	<CIRCLE><!-- 1 -->
		<OPTIONALTALENT name="Erster Eindruck"/>
		<OPTIONALTALENT name="Hieb Ausweichen"/>
		<OPTIONALTALENT name="Klettern"/>
		<OPTIONALTALENT name="Nahkampfwaffen"/>
		<OPTIONALTALENT name="Projektilwaffen"/>
		<OPTIONALTALENT name="Sprint"/>
		<OPTIONALTALENT name="Überraschungsschlag"/>
		<OPTIONALTALENT name="Verspotten"/>
		<OPTIONALTALENT name="Weitsprung"/>
		<OPTIONALTALENT name="Wurfwaffen"/>
		<FREETALENT name="Gefahrensinn"/>
		<DISCIPLINETALENT name="Aufmerksamkeit"/>
		<DISCIPLINETALENT name="Fadenweben" limitation="Diebweben"/>
		<DISCIPLINETALENT name="Heimlicher Schritt"/>
		<DISCIPLINETALENT name="Schloss Knacken"/>
		<DISCIPLINETALENT name="Taschendiebstahl"/>
		<TALENTABILITY/>
		<KARMA spend="Charismaproben beim Täuschen"/>
	</CIRCLE>
	<CIRCLE><!-- 2 -->
		<DISCIPLINETALENT name="Fallen Entschärfen"/>
		<TALENTABILITY/>
		<DEFENSE kind="physical"/>
	</CIRCLE>
	<CIRCLE><!-- 3 -->
		<DISCIPLINETALENT name="Feilschen"/>
		<TALENTABILITY/>
		<KARMA spend="Initiativeproben"/>
	</CIRCLE>
	<CIRCLE><!-- 4 -->
		<DISCIPLINETALENT name="Gegenstand Verbergen"/>
		<TALENTABILITY/>
		<DEFENSE kind="social"/>
	</CIRCLE>
	<CIRCLE><!-- 5 -->
		<OPTIONALTALENT name="Eleganter Abgang"/>
		<OPTIONALTALENT name="Klingen Jonglieren"/>
		<OPTIONALTALENT name="Mystische Verfolgung"/>
		<OPTIONALTALENT name="Magische Maske"/>
		<OPTIONALTALENT name="Projektil Rufen"/>
		<OPTIONALTALENT name="Schwachstelle Erkennen"/>
		<OPTIONALTALENT name="Stimmen Imitieren"/>
		<OPTIONALTALENT name="Totstellen"/>
		<OPTIONALTALENT name="Untrüglicher Blick"/>
		<OPTIONALTALENT name="Zweitwaffe"/>
		<DISCIPLINETALENT name="Wortgeplänkel"/>
		<TALENTABILITY/>
		<KARMA spend="Angriffsproben bei Überraschung oder Toter Winkel"/>
		<ABILITY>Schattenmantel</ABILITY>
	</CIRCLE>
	<CIRCLE><!-- 6 -->
		<DISCIPLINETALENT name="Schuld Abwälzen"/>
		<TALENTABILITY/>
		<DEFENSE kind="physical"/>
	</CIRCLE>
	<CIRCLE><!-- 7 -->
		<DISCIPLINETALENT name="Flinke Hand"/>
		<TALENTABILITY/>
		<INITIATIVE/>
	</CIRCLE>
	<CIRCLE><!-- 8 -->
		<DISCIPLINETALENT name="Illusionsverstärkung"/>
		<TALENTABILITY/>
		<DEFENSE kind="physical"/>
	</CIRCLE>
	<CIRCLE><!-- 9 -->
		<OPTIONALTALENT name="Akrobatische Verteidigung"/>
		<OPTIONALTALENT name="Astralsicht"/>
		<OPTIONALTALENT name="Echolot"/>
		<OPTIONALTALENT name="Fluchtplan"/>
		<OPTIONALTALENT name="Kampfsinn"/>
		<OPTIONALTALENT name="Kreisender Spion"/>
		<OPTIONALTALENT name="Perfekte Konzentration"/>
		<OPTIONALTALENT name="Starrsinn"/>
		<OPTIONALTALENT name="Tigersprung"/>
		<OPTIONALTALENT name="Windkissen"/>
		<DISCIPLINETALENT name="Machtmaskierung"/>
		<TALENTABILITY/>
		<KARMA spend="Erholungsproben"/>
		<ABILITY>Schattensicht</ABILITY>
	</CIRCLE>
	<CIRCLE><!-- 10 -->
		<DISCIPLINETALENT name="Astraltasche"/>
		<TALENTABILITY/>
		<DEFENSE kind="social"/>
		<RECOVERYTESTPERDAY/>
	</CIRCLE>
	<CIRCLE><!-- 11 -->
		<DISCIPLINETALENT name="Chamäleon"/>
		<TALENTABILITY/>
		<DEFENSE kind="mystic"/>
		<KARMA spend="Schadensproben gegen Ziele mit Malus auf körperlicher Verteidigung"/>
	</CIRCLE>
	<CIRCLE><!-- 12 -->
		<DISCIPLINETALENT name="Täuschende Klinge"/>
		<TALENTABILITY/>
		<DEFENSE kind="physical"/>
		<INITIATIVE/>
	</CIRCLE>
	<CIRCLE><!-- 13 -->
		<OPTIONALTALENT name="Astralangriff"/>
		<OPTIONALTALENT name="Entwaffnendes Lächeln"/>
		<OPTIONALTALENT name="Fließende Bewegung"/>
		<OPTIONALTALENT name="Geistwandeln"/>
		<OPTIONALTALENT name="Kritischer Treffer"/>
		<OPTIONALTALENT name="Verteidigungshaltung"/>
		<OPTIONALTALENT name="Wie Eine Streunende Katze"/>
		<OPTIONALTALENT name="Zweite Chance"/>
		<DISCIPLINETALENT name="Unmögliches Versteck"/>
		<TALENTABILITY/>
		<DEFENSE kind="social"/>
		<ARMOR name="additional discipline bonus" weight="0" used="yes" location="self" mysticarmor="1"/>
		<KARMASTEP />
		<ABILITY>Eins mit dem Schatten</ABILITY>
	</CIRCLE>
	<CIRCLE><!-- 14 -->
		<DISCIPLINETALENT name="Talentdiebstahl"/>
		<TALENTABILITY/>
		<DEFENSE kind="physical"/>
		<RECOVERYTESTPERDAY/>
	</CIRCLE>
	<CIRCLE><!-- 15 -->
		<DISCIPLINETALENT name="Traumdieb"/>
		<TALENTABILITY/>
		<DEFENSE kind="mystic"/>
		<INITIATIVE/>
	</CIRCLE>
	<KARMARITUAL>Bitte füge eine Kurzbeschreibung für ein Karmaritual ein, die Dauer beträgt 30 Min.</KARMARITUAL>
	<HALFMAGIC>Diebe können Halbmagie einsetzen, um Sicherheitsmaßnahmen zu bauen oder zu umgehen, die Diebstähle verhindern sollen, und um verschiedene Arten von Schließmechanismen zu erkennen.</HALFMAGIC>
</DISCIPLINE>
