<?xml version="1.0" encoding="UTF-8" standalone="no"?>
<DISCIPLINE name="Schwermeister" lang="de" rulesetversion="ED4" xmlns="http://earthdawn.com/discipline" xmlns:xsi="http://www.w3.org/2001/XMLSchema-instance" xmlns:edt="http://earthdawn.com/datatypes" xsi:schemaLocation="http://earthdawn.com/discipline ../../earthdawndiscipline.xsd">
	<DURABILITY value="7" circle="1"/>
	<CIRCLE><!-- 1 -->
		<OPTIONALTALENT name="Ablenken"/>
		<OPTIONALTALENT name="Akrobatische Verteidigung"/>
		<OPTIONALTALENT name="Beeindrucken"/>
		<OPTIONALTALENT name="Fremdsprachen"/>
		<OPTIONALTALENT name="Gefahrensinn"/>
		<OPTIONALTALENT name="Gewinnendes Lächeln"/>
		<OPTIONALTALENT name="Kampfsinn"/>
		<OPTIONALTALENT name="Standhaftigkeit"/>
		<OPTIONALTALENT name="Tigersprung"/>
		<OPTIONALTALENT name="Waffenloser Kampf"/>
		<DISCIPLINETALENT name="Fadenweben" limitation="Waffenweben"/>
		<DISCIPLINETALENT name="Hieb Ausweichen"/>
		<DISCIPLINETALENT name="Manövrieren"/>
		<DISCIPLINETALENT name="Nahkampfwaffen"/>
		<DISCIPLINETALENT name="Verspotten"/>
		<TALENTABILITY/>
	</CIRCLE>
	<CIRCLE><!-- 2 -->
		<DISCIPLINETALENT name="Erster Eindruck"/>
		<TALENTABILITY/>
		<DEFENSE kind="social"/>
	</CIRCLE>
	<CIRCLE><!-- 3 -->
		<DISCIPLINETALENT name="Riposte"/>
		<TALENTABILITY/>
		<KARMA spend="Interaktionsproben"/>
	</CIRCLE>
	<CIRCLE><!-- 4 -->
		<DISCIPLINETALENT name="Herzliches Lachen"/>
		<TALENTABILITY/>
		<DEFENSE kind="physical"/>
	</CIRCLE>
	<CIRCLE><!-- 5 -->
		<OPTIONALTALENT name="Bleibender Eindruck"/>
		<OPTIONALTALENT name="Eleganter Abgang"/>
		<OPTIONALTALENT name="Etikette"/>
		<OPTIONALTALENT name="Kobrastoß"/>
		<OPTIONALTALENT name="Löwenherz"/>
		<OPTIONALTALENT name="Luftgleiten"/>
		<OPTIONALTALENT name="Nachtreten"/>
		<OPTIONALTALENT name="Schwachstelle Erkennen"/>
		<OPTIONALTALENT name="Sprint"/>
		<OPTIONALTALENT name="Wortgeplänkel"/>
		<DISCIPLINETALENT name="Zweitwaffe"/>
		<TALENTABILITY/>
		<KARMA spend="Schadensproben mit einer Nahkampfwaffe"/>
		<ABILITY>Einschätzen</ABILITY>
	</CIRCLE>
	<CIRCLE><!-- 6 -->
		<DISCIPLINETALENT name="Entwaffnen"/>
		<TALENTABILITY/>
		<DEFENSE kind="social"/>
	</CIRCLE>
	<CIRCLE><!-- 7 -->
		<DISCIPLINETALENT name="Starrsinn"/>
		<TALENTABILITY/>
		<INITIATIVE/>
	</CIRCLE>
	<CIRCLE><!-- 8 -->
		<DISCIPLINETALENT name="Zweiter Angriff"/>
		<TALENTABILITY/>
		<DEFENSE kind="social"/>
	</CIRCLE>
	<CIRCLE><!-- 9 -->
		<OPTIONALTALENT name="Astralangriff"/>
		<OPTIONALTALENT name="Ätherwaffe"/>
		<OPTIONALTALENT name="Empathische Wahrnehmung"/>
		<OPTIONALTALENT name="Herausforderung der Besten"/>
		<OPTIONALTALENT name="Letzte Rettung"/>
		<OPTIONALTALENT name="Löwenmut"/>
		<OPTIONALTALENT name="Matrixsicht"/>
		<OPTIONALTALENT name="Schlagfertige Erwiderung"/>
		<OPTIONALTALENT name="Unaufhaltsame Erholung"/>
		<OPTIONALTALENT name="Untergraben"/>
		<DISCIPLINETALENT name="Kritischer Treffer"/>
		<TALENTABILITY/>
		<KARMA spend="Erholungsproben"/>
		<ABILITY>Blutgebunde Waffen</ABILITY>
	</CIRCLE>
	<CIRCLE><!-- 10 -->
		<DISCIPLINETALENT name="Schwungvoller Angriff"/>
		<TALENTABILITY/>
		<DEFENSE kind="social"/>
		<RECOVERYTESTPERDAY/>
	</CIRCLE>
	<CIRCLE><!-- 11 -->
		<DISCIPLINETALENT name="Schwungvoller Angriff"/>
		<TALENTABILITY/>
		<DEFENSE kind="mystic"/>
		<KARMA spend="Angriff gegen verspottete Gegner"/>
	</CIRCLE>
	<CIRCLE><!-- 12 -->
		<DISCIPLINETALENT name="Fließende Bewegung"/>
		<TALENTABILITY/>
		<DEFENSE kind="physical"/>
		<INITIATIVE/>
	</CIRCLE>
	<CIRCLE><!-- 13 -->
		<OPTIONALTALENT name="Aurarüstung"/>
		<OPTIONALTALENT name="Bardenstimme"/>
		<OPTIONALTALENT name="Eisiger Schlag"/>
		<OPTIONALTALENT name="Schmerzen Widerstehen"/>
		<OPTIONALTALENT name="Seelenschutz"/>
		<OPTIONALTALENT name="Unverzagte Tapferkeit"/>
		<OPTIONALTALENT name="Vitaler Schutz"/>
		<OPTIONALTALENT name="Zweite Chance"/>
		<DISCIPLINETALENT name="Schneidende Worte"/>
		<TALENTABILITY/>
		<DEFENSE kind="social"/>
		<ARMOR name="additional discipline bonus" weight="0" used="yes" location="self" mysticarmor="1"/>
		<KARMASTEP />
	</CIRCLE>
	<CIRCLE><!-- 14 -->
		<DISCIPLINETALENT name="Üble Wunde"/>
		<TALENTABILITY/>
		<DEFENSE kind="physical"/>
		<RECOVERYTESTPERDAY/>
	</CIRCLE>
	<CIRCLE><!-- 15 -->
		<DISCIPLINETALENT name="Mehrfacher Schlag"/>
		<TALENTABILITY/>
		<DEFENSE kind="mystic"/>
		<INITIATIVE/>
	</CIRCLE>
	<KARMARITUAL>Bitte füge eine Kurzbeschreibung für ein Karmaritual ein, die Dauer beträgt 30 Min. </KARMARITUAL>
	<HALFMAGIC> Pflege ihrer Waffen; Wissen über: legendäre Waffen, Typen von Nahkampfwaffen; Erkennen von Schwertmeister Techniken und Kampfstile berühmter Schwertmeister</HALFMAGIC>
</DISCIPLINE>
