<?xml version="1.0" encoding="UTF-8" standalone="no"?>
<DISCIPLINE  name="Purifier" lang="en" bookref="NG p.172" xmlns="http://earthdawn.com/discipline" xmlns:xsi="http://www.w3.org/2001/XMLSchema-instance" xmlns:edt="http://earthdawn.com/datatypes" xsi:schemaLocation="http://earthdawn.com/discipline ../../earthdawndiscipline.xsd">
	<DURABILITY death="7" unconsciousness="6"/>
	<CIRCLE><!-- 1 -->
		<OPTIONALTALENT name="Acrobatic Strike"/>
		<OPTIONALTALENT name="Avoid Blow"/>
		<OPTIONALTALENT name="Battle Shout"/>
		<OPTIONALTALENT name="Sprint"/>
		<OPTIONALTALENT name="Wilderness Survival"/>
		<DISCIPLINETALENT name="Body Control"/>
		<DISCIPLINETALENT name="Clay Skin"/>
		<DISCIPLINETALENT name="Karma Ritual"/>
		<DISCIPLINETALENT name="Unarmed Combat"/>
		<DISCIPLINETALENT name="Wound Balance"/>
		<TALENTABILITY/>
	</CIRCLE>
	<CIRCLE><!-- 2 -->
		<OPTIONALTALENT name="Creature Analysis"/>
		<OPTIONALTALENT name="Durability"/>
		<OPTIONALTALENT name="Heartening Laugh"/>
		<OPTIONALTALENT name="Maneuver"/>
		<OPTIONALTALENT name="Swift Kick"/>
		<OPTIONALTALENT name="Throwing Weapons"/>
		<OPTIONALTALENT name="Tiger Spring"/>
		<OPTIONALTALENT name="Tracking"/>
		<DISCIPLINETALENT name="Lifesight"/>
		<TALENTABILITY/>
		<DEFENSE kind="physical"/>
	</CIRCLE>
	<CIRCLE><!-- 3 -->
		<DISCIPLINETALENT name="Spirit Talk"/>
		<TALENTABILITY/>
	</CIRCLE>
	<CIRCLE><!-- 4 -->
		<DISCIPLINETALENT name="Thread Weaving" limitation="Earth Weaving"/>
		<TALENTABILITY/>
		<KARMA spend="Strengh-only Test"/>
	</CIRCLE>
	<CIRCLE><!-- 5 -->
		<OPTIONALTALENT name="Astral Sight"/>
		<OPTIONALTALENT name="Earth Skin"/>
		<OPTIONALTALENT name="Great Leap"/>
		<OPTIONALTALENT name="Lion Heart"/>
		<OPTIONALTALENT name="Resist Taunt"/>
		<OPTIONALTALENT name="Steel Thought"/>
		<OPTIONALTALENT name="Steely Stare"/>
		<OPTIONALTALENT name="Temper Self"/>
		<DISCIPLINETALENT name="Earth Bond"/>
		<TALENTABILITY/>
		<ABILITY>Cleanse</ABILITY>
	</CIRCLE>
	<CIRCLE><!-- 6 -->
		<DISCIPLINETALENT name="Life Check"/>
		<TALENTABILITY/>
		<KARMA spend="Toughness-only Test"/>
	</CIRCLE>
	<CIRCLE><!-- 7 -->
		<DISCIPLINETALENT name="Crushing Blow"/>
		<TALENTABILITY/>
		<KARMA spend="unarmend Damage Tests"/>
	</CIRCLE>
	<CIRCLE><!-- 8 -->
		<DISCIPLINETALENT name="Momentum Attack"/>
		<TALENTABILITY/>
		<DEFENSE kind="physical"/>
	</CIRCLE>
	<CIRCLE><!-- 9 -->
		<OPTIONALTALENT name="Critical Hit"/>
		<OPTIONALTALENT name="Frenzy"/>
		<OPTIONALTALENT name="Lion Spirit"/>
		<OPTIONALTALENT name="Matrix Strike"/>
		<OPTIONALTALENT name="Metal Ward"/>
		<OPTIONALTALENT name="Poison Resistance"/>
		<OPTIONALTALENT name="Resist Pain"/>
		<OPTIONALTALENT name="Spirit Strike"/>
		<DISCIPLINETALENT name="Safe Path"/>
		<TALENTABILITY/>
		<KARMA spend="Recovery Test"/>
		<ABILITY>Earth's Avenger</ABILITY>
	</CIRCLE>
	<CIRCLE><!-- 10 -->
		<DISCIPLINETALENT name="Plant Shelter"/>
		<TALENTABILITY/>
		<DEFENSE kind="physical"/>
		<INITIATIVE/>
	</CIRCLE>
	<CIRCLE><!-- 11 -->
		<DISCIPLINETALENT name="Vitality"/>
		<TALENTABILITY/>
		<DEFENSE kind="mystic"/>
		<DEFENSE kind="social"/>
		<KARMA spend="Willpower-only Test"/>
	</CIRCLE>
	<CIRCLE><!-- 12 -->
		<DISCIPLINETALENT name="Earth Armor"/>
		<TALENTABILITY/>
		<DEFENSE kind="physical"/>
		<INITIATIVE/>
	</CIRCLE>
	<CIRCLE><!-- 13 -->
		<OPTIONALTALENT name="Chameleon"/>
		<OPTIONALTALENT name="Detect Influence"/>
		<OPTIONALTALENT name="Moving Earth"/>
		<OPTIONALTALENT name="Rushing Attack"/>
		<OPTIONALTALENT name="Stone Skin"/>
		<OPTIONALTALENT name="Whirlwind"/>
		<DISCIPLINETALENT name="Second Chance"/>
		<TALENTABILITY/>
		<DEFENSE kind="mystic"/>
		<KARMASTEP/>
		<ABILITY>Sanctify</ABILITY>
	</CIRCLE>
	<CIRCLE><!-- 14 -->
		<DISCIPLINETALENT name="Vital Strike"/>
		<TALENTABILITY/>
		<DEFENSE kind="physical"/>
		<INITIATIVE/>
	</CIRCLE>
	<CIRCLE><!-- 15 -->
		<DISCIPLINETALENT name="Elemental Walk"/>
		<TALENTABILITY/>
		<DEFENSE kind="mystic"/>
		<DEFENSE kind="social"/>
	</CIRCLE>
	<KARMARITUAL>Please insert a short description of your Karma Ritual. It have to last for 30 minutes</KARMARITUAL>
	<HALFMAGIC>knowledge: all aspects of nature, preserving natural environs, all that tends to currupt nature (including Horrors, misdeeds of Namegiver civilization); Skill: Navigation, Wilderness Survival;(NG p.175)</HALFMAGIC>
</DISCIPLINE>