<?xml version="1.0" encoding="UTF-8" standalone="no"?>
<DISCIPLINE name="Daughter of Heaven" lang="en" bookref="CPG p.31" xmlns="http://earthdawn.com/discipline" xmlns:xsi="http://www.w3.org/2001/XMLSchema-instance" xmlns:edt="http://earthdawn.com/datatypes" xsi:schemaLocation="http://earthdawn.com/discipline ../../earthdawndiscipline.xsd">
	<DURABILITY death="6" unconsciousness="5"/>
	<CIRCLE><!-- 1 -->
		<OPTIONALTALENT name="First Impression"/>
		<OPTIONALTALENT name="Melee Weapons"/>
		<OPTIONALTALENT name="Navigation"/>
		<OPTIONALTALENT name="Unarmed Combat"/>
		<OPTIONALTALENT name="Wilderness Survival"/>
		<DISCIPLINETALENT name="Avoid Blow"/>
		<DISCIPLINETALENT name="Embrace of the Phoenix"/>
		<DISCIPLINETALENT name="Karma Ritual"/>
		<DISCIPLINETALENT name="Lifesight"/>
		<DISCIPLINETALENT name="Wound Balance"/>
		<TALENTABILITY/>
	</CIRCLE>
	<CIRCLE><!-- 2 -->
		<OPTIONALTALENT name="Anticipate Blow"/>
		<OPTIONALTALENT name="Close In"/>
		<OPTIONALTALENT name="Conceal Object"/>
		<OPTIONALTALENT name="Durability"/>
		<OPTIONALTALENT name="Detect Weapon"/>
		<OPTIONALTALENT name="Missile Weapons"/>
		<OPTIONALTALENT name="Parry"/>
		<OPTIONALTALENT name="Throwing Weapons"/>
		<DISCIPLINETALENT name="Fire Heal"/>
		<TALENTABILITY/>
		<DEFENSE kind="physical"/>
	</CIRCLE>
	<CIRCLE><!-- 3 -->
		<DISCIPLINETALENT name="Improvised Poultice"/>
		<TALENTABILITY/>
	</CIRCLE>
	<CIRCLE><!-- 4 -->
		<DISCIPLINETALENT name="Thread Weaving" limitation="Thread Mending"/>
		<TALENTABILITY/>
		<KARMA spend="Toughness-only Test"/>
	</CIRCLE>
	<CIRCLE><!-- 5 -->
		<OPTIONALTALENT name="Diplomacy"/>
		<OPTIONALTALENT name="Disarm"/>
		<OPTIONALTALENT name="Empathic Sense"/>
		<OPTIONALTALENT name="Fireblood"/>
		<OPTIONALTALENT name="Leadership"/>
		<OPTIONALTALENT name="Sense Poison"/>
		<OPTIONALTALENT name="Shackle Shrug"/>
		<OPTIONALTALENT name="Tiger Spring"/>
		<DISCIPLINETALENT name="Gift of the Phoenix"/>
		<TALENTABILITY/>
		<ABILITY>Gift of heaven</ABILITY>
	</CIRCLE>
	<CIRCLE><!-- 6 -->
		<DISCIPLINETALENT name="Counteract"/>
		<TALENTABILITY/>
		<KARMA spend="Willpower-only Test"/>
	</CIRCLE>
	<CIRCLE><!-- 7 -->
		<DISCIPLINETALENT name="Life Check"/>
		<TALENTABILITY/>
		<KARMA spend="Test made by target to heal damage/ resist poison or disease. Adept has to be adjacent to target to grant Karma Point."/>
	</CIRCLE>
	<CIRCLE><!-- 8 -->
		<DISCIPLINETALENT name="Touch of the Phoenix"/>
		<TALENTABILITY/>
		<DEFENSE kind="physical"/>
	</CIRCLE>
	<CIRCLE><!-- 9 -->
		<OPTIONALTALENT name="Critical Hit"/>
		<OPTIONALTALENT name="Endure Cold"/>
		<OPTIONALTALENT name="Frenzy"/>
		<OPTIONALTALENT name="Impressive Shot"/>
		<OPTIONALTALENT name="Impressive Strike"/>
		<OPTIONALTALENT name="Poison Resistance"/>
		<OPTIONALTALENT name="Quick Shot"/>
		<OPTIONALTALENT name="Vitality"/>
		<DISCIPLINETALENT name="Shield of the Innocent"/>
		<TALENTABILITY/>
		<KARMA spend="Recovery Test"/>
		<ABILITY>Trust of the Phoenix</ABILITY>
	</CIRCLE>
	<CIRCLE><!-- 10 -->
		<DISCIPLINETALENT name="Lion Spirit"/>
		<TALENTABILITY/>
		<DEFENSE kind="physical"/>
		<RECOVERYTESTPERDAY/>
	</CIRCLE>
	<CIRCLE><!-- 11 -->
		<DISCIPLINETALENT name="Cyclone"/>
		<TALENTABILITY/>
		<DEFENSE kind="mystic"/>
		<DEFENSE kind="social"/>
		<KARMA spend="reduce Current Damage of adjacent target by result (once per round)"/>
	</CIRCLE>
	<CIRCLE><!-- 12 -->
		<DISCIPLINETALENT name="Path of the Righteous"/>
		<TALENTABILITY/>
		<DEFENSE kind="physical"/>
		<RECOVERYTESTPERDAY/>
	</CIRCLE>
	<CIRCLE><!-- 13 -->
		<OPTIONALTALENT name="Confront Horror"/>
		<OPTIONALTALENT name="Detect Influence"/>
		<OPTIONALTALENT name="First Ring of Perfection"/>
		<OPTIONALTALENT name="Resist Pain"/>
		<OPTIONALTALENT name="Vital Strike"/>
		<OPTIONALTALENT name="Wound Transfer"/>
		<DISCIPLINETALENT name="Aura Armor"/>
		<TALENTABILITY/>
		<DEFENSE kind="social"/>
		<KARMASTEP/>
		<ABILITY>Grace of the Phoenix</ABILITY>
	</CIRCLE>
	<CIRCLE><!-- 14 -->
		<DISCIPLINETALENT name="Second Chance"/>
		<TALENTABILITY/>
		<DEFENSE kind="physical"/>
		<INITIATIVE/>
	</CIRCLE>
	<CIRCLE><!-- 15 -->
		<DISCIPLINETALENT name="Purge Pattern"/>
		<TALENTABILITY/>
		<DEFENSE kind="mystic"/>
		<DEFENSE kind="social"/>
		<INITIATIVE/>
	</CIRCLE>
	<KARMARITUAL>Please insert a short description of your Karma Ritual. It have to last for 30 minutes</KARMARITUAL>
	<HALFMAGIC>knowledge: Namegiver physiology, illnesses, diseases, poisons and how to treat them, medicinal herbs and plants; craft simple healing aids (bandages, splints, etc.); Skill: Alchemy for Analysis/Gathering Ingredients requires produce improvised poultices; (CPG p.32)</HALFMAGIC>
</DISCIPLINE>

