<?xml version="1.0" encoding="UTF-8" standalone="no"?>
<DISCIPLINE name="Swordmaster-Gallant" lang="en" xmlns="http://earthdawn.com/discipline" xmlns:xsi="http://www.w3.org/2001/XMLSchema-instance" xmlns:edt="http://earthdawn.com/datatypes" xsi:schemaLocation="http://earthdawn.com/discipline ../../earthdawndiscipline.xsd">
	<DURABILITY death="7" unconsciousness="6"/>
	<CIRCLE><!-- 1 -->
		<OPTIONALTALENT name="Acrobatic Strike"/>
		<OPTIONALTALENT name="Avoid Blow"/>
		<OPTIONALTALENT name="Maneuver"/>
		<OPTIONALTALENT name="Speak Language"/>
		<OPTIONALTALENT name="Wound Balance"/>
		<DISCIPLINETALENT name="Karma Ritual"/>
		<DISCIPLINETALENT name="First Impression"/>
		<DISCIPLINETALENT name="Melee Weapons"/>
		<DISCIPLINETALENT name="Parry"/>
		<DISCIPLINETALENT name="Taunt"/>
		<TALENTABILITY/>
	</CIRCLE>
	<CIRCLE><!-- 2 -->
		<OPTIONALTALENT name="Anticipate Blow"/>
		<OPTIONALTALENT name="Detect Weapon"/>
		<OPTIONALTALENT name="Durability"/>
		<OPTIONALTALENT name="Haggle"/>
		<OPTIONALTALENT name="Sprint"/>
		<OPTIONALTALENT name="Throwing Weapons"/>
		<OPTIONALTALENT name="Unarmed Combat"/>
		<OPTIONALTALENT name="Heartening Laugh"/>
		<DISCIPLINETALENT name="Winning Smile"/>
		<TALENTABILITY/>
		<DEFENSE kind="social"/>
	</CIRCLE>
	<CIRCLE><!-- 3 -->
		<DISCIPLINETALENT name="Riposte"/>
		<TALENTABILITY/>
	</CIRCLE>
	<CIRCLE><!-- 4 -->
		<DISCIPLINETALENT name="Thread Weaving" limitation="Weapon Weaving"/>
		<TALENTABILITY/>
		<KARMA spend="Dexterity-only Test"/>
	</CIRCLE>
	<CIRCLE><!-- 5 -->
		<OPTIONALTALENT name="Conceal Object"/>
		<OPTIONALTALENT name="Etiquette"/>
		<OPTIONALTALENT name="Graceful Exit"/>
		<OPTIONALTALENT name="Disarm"/>
		<OPTIONALTALENT name="Lion Heart"/>
		<OPTIONALTALENT name="Surprise Strike"/>
		<OPTIONALTALENT name="Swift Kick"/>
		<OPTIONALTALENT name="Tiger Spring"/>
		<DISCIPLINETALENT name="Second Weapon"/>
		<TALENTABILITY/>
		<ABILITY>Flourish</ABILITY>
	</CIRCLE>
	<CIRCLE><!-- 6 -->
		<DISCIPLINETALENT name="Lasting Impression"/>
		<TALENTABILITY/>
		<KARMA spend="Charisma-only Test"/>
	</CIRCLE>
	<CIRCLE><!-- 7 -->
		<DISCIPLINETALENT name="Resist Taunt"/>
		<TALENTABILITY/>
		<KARMA spend="mele weapon Damage Test"/>
	</CIRCLE>
	<CIRCLE><!-- 8 -->
		<DISCIPLINETALENT name="Second Attack"/>
		<TALENTABILITY/>
		<DEFENSE kind="social"/>
	</CIRCLE>
		<CIRCLE><!-- 9 -->
		<OPTIONALTALENT name="Critical Hit"/>
		<OPTIONALTALENT name="Life Check"/>
		<OPTIONALTALENT name="Mind Blade"/>
		<OPTIONALTALENT name="Pin"/>
		<OPTIONALTALENT name="Shield Beater"/>
		<OPTIONALTALENT name="Shield Charge"/>
		<OPTIONALTALENT name="Spirit Strike"/>
		<OPTIONALTALENT name="Whirlwind"/>
		<DISCIPLINETALENT name="Impressive Strike"/>
		<TALENTABILITY/>
		<KARMA spend="Recovery Test"/>
		<ABILITY>Weapon Bond</ABILITY>
	</CIRCLE>
	<CIRCLE><!-- 10 -->
		<DISCIPLINETALENT name="Champion Challenge"/>
		<TALENTABILITY/>
		<DEFENSE kind="social"/>
		<RECOVERYTESTPERDAY/>
	</CIRCLE>
	<CIRCLE><!-- 11 -->
		<DISCIPLINETALENT name="Spot Armor Flaw"/>
		<TALENTABILITY/>
		<DEFENSE kind="physical"/>
		<DEFENSE kind="mystic"/>
	</CIRCLE>
	<CIRCLE><!-- 12 -->
		<DISCIPLINETALENT name="Defense"/>
		<TALENTABILITY/>
		<DEFENSE kind="social"/>
		<INITIATIVE/>
	</CIRCLE>
	<CIRCLE><!-- 13 -->
		<OPTIONALTALENT name="Infuse Blade"/>
		<OPTIONALTALENT name="Lion Spirit"/>
		<OPTIONALTALENT name="Mind Armor"/>
		<OPTIONALTALENT name="Missile Twister"/>
		<OPTIONALTALENT name="Rushing Attack"/>
		<OPTIONALTALENT name="Second Chance"/>
		<DISCIPLINETALENT name="Vital Strike"/>
		<TALENTABILITY/>
		<DEFENSE kind="physical"/>
		<KARMASTEP/>
		<ABILITY>Keen Blade</ABILITY>
	</CIRCLE>
	<CIRCLE><!-- 14 -->
		<DISCIPLINETALENT name="Multi-Strike"/>
		<TALENTABILITY/>
		<DEFENSE kind="social"/>
		<KARMA spend="Perception-only Test"/>
	</CIRCLE>
	<CIRCLE><!-- 15 -->
		<DISCIPLINETALENT name="Ethereal Weapon"/>
		<TALENTABILITY/>
		<DEFENSE kind="physical"/>
		<DEFENSE kind="mystic"/>
		<INITIATIVE/>
	</CIRCLE>
	<KARMARITUAL>Please insert a short description of your Karma Ritual. It have to last for 30 minutes</KARMARITUAL>
	<HALFMAGIC>care their weapons; knowledge: history legendary weapons, types melee weapons; identify Swordmaster’s fighting techniques, including which prominent Swordmasters shaped individual’s style;(PG p.51)</HALFMAGIC>
</DISCIPLINE>
