<?xml version="1.0" encoding="UTF-8" standalone="no"?>
<DISCIPLINE name="Sailor" lang="en" rulesetversion="ED4" xmlns="http://earthdawn.com/discipline" xmlns:xsi="http://www.w3.org/2001/XMLSchema-instance" xmlns:edt="http://earthdawn.com/datatypes" xsi:schemaLocation="http://earthdawn.com/discipline ../../earthdawndiscipline.xsd">
	<DURABILITY value="5" circle="1"/>
	<CIRCLE><!-- 1 -->
		<OPTIONALTALENT name="Acrobatic Defense"/>
		<OPTIONALTALENT name="Distract"/>
		<OPTIONALTALENT name="First Impression"/>
		<OPTIONALTALENT name="Great Leap"/>
		<OPTIONALTALENT name="Haggle"/>
		<OPTIONALTALENT name="Maneuver"/>
		<OPTIONALTALENT name="Navigation"/>
		<OPTIONALTALENT name="Speak Language"/>
		<OPTIONALTALENT name="Taunt"/>
		<OPTIONALTALENT name="Throwing Weapons"/>
		<FREETALENT name="Sailing"/>
		<DISCIPLINETALENT name="Avoid Blow"/>
		<DISCIPLINETALENT name="Climbing"/>
		<DISCIPLINETALENT name="Melee Weapons"/>
		<DISCIPLINETALENT name="Thread Weaving" limitation="Sea Weaving"/>
		<DISCIPLINETALENT name="Swimming"/>
		<TALENTABILITY/>
		<KARMA spend="once per round on any action taken while on board an airship"/>
	</CIRCLE>
	<CIRCLE><!-- 2 -->
		<DISCIPLINETALENT name="Awareness"/>
		<TALENTABILITY/>
		<DEFENSE kind="physical"/>
	</CIRCLE>
	<CIRCLE><!-- 3 -->
		<DISCIPLINETALENT name="Empathic Sense"/>
		<TALENTABILITY/>
		<KARMA spend="on Initiative tests"/>
	</CIRCLE>
	<CIRCLE><!-- 4 -->
		<DISCIPLINETALENT name="Wound Balance"/>
		<TALENTABILITY/>
		<DEFENSE kind="social"/>
	</CIRCLE>
	<CIRCLE><!-- 5 -->
		<OPTIONALTALENT name="Air Speaking"/>
		<OPTIONALTALENT name="Battle Bellow"/>
		<OPTIONALTALENT name="Conceal Object"/>
		<OPTIONALTALENT name="Engaging Banter"/>
		<OPTIONALTALENT name="Etiquette"/>
		<OPTIONALTALENT name="Graceful Exit"/>
		<OPTIONALTALENT name="Leadership"/>
		<OPTIONALTALENT name="Resist Taunt"/>
		<OPTIONALTALENT name="Second Weapon"/>
		<OPTIONALTALENT name="Surprise Strike"/>
		<DISCIPLINETALENT name="Heartening Laugh"/>
		<TALENTABILITY/>
		<KARMA spend="on Interaction Tests"/>
		<ABILITY>Collaborate</ABILITY>
	</CIRCLE>
	<CIRCLE><!-- 6 -->
		<DISCIPLINETALENT name="Air Dance"/>
		<TALENTABILITY/>
		<DEFENSE kind="physical"/>
	</CIRCLE>
	<CIRCLE><!-- 7 -->
		<DISCIPLINETALENT name="Inspire Others"/>
		<TALENTABILITY/>
		<RECOVERYTESTPERDAY/>
	</CIRCLE>
	<CIRCLE><!-- 8 -->
		<DISCIPLINETALENT name="Lion Heart"/>
		<TALENTABILITY/>
		<DEFENSE kind="physical"/>
	</CIRCLE>
	<KARMARITUAL>The Boatman sits alone in silent meditation preferably near a river or other body of water for several minutes, picturing in their mindâ€™s eye their riverboat cruising through the current at the start of a long journey. The adept envisions a journey they hope to make one day, imagining scenes of this journey, including the risks and perils, and how their training and skills might help make the journey a safe one. The ritual is complete when, half an hour later, the imagined journey ends safely.</KARMARITUAL>
	<HALFMAGIC>The Sailor uses Half-Magic for knowledge of ship designs, recognition of different kinds of ships, common sea trade routes, and ship crew compliments. It also covers the maintenance, repair, and construction of ships.</HALFMAGIC>
</DISCIPLINE>