<?xml version="1.0" encoding="UTF-8" standalone="no"?>
<DISCIPLINE name="Pugilist" lang="en" bookref="CPG p.50" xmlns="http://earthdawn.com/discipline" xmlns:xsi="http://www.w3.org/2001/XMLSchema-instance" xmlns:edt="http://earthdawn.com/datatypes" xsi:schemaLocation="http://earthdawn.com/discipline ../../earthdawndiscipline.xsd">
	<DURABILITY death="9" unconsciousness="7"/>
	<CIRCLE><!-- 1 -->
		<OPTIONALTALENT name="Acrobatic Strike"/>
		<OPTIONALTALENT name="Close In"/>
		<OPTIONALTALENT name="Impress"/>
		<OPTIONALTALENT name="Maneuver"/>
		<OPTIONALTALENT name="Wound Balance"/>
		<DISCIPLINETALENT name="Block and Counter"/>
		<DISCIPLINETALENT name="Jab"/>
		<DISCIPLINETALENT name="Karma Ritual"/>
		<DISCIPLINETALENT name="Performance"/>
		<DISCIPLINETALENT name="Unarmed Combat"/>
		<TALENTABILITY/>
	</CIRCLE>
	<CIRCLE><!-- 2 -->
		<OPTIONALTALENT name="Air Speaking"/>
		<OPTIONALTALENT name="Avoid Blow"/>
		<OPTIONALTALENT name="Distract"/>
		<OPTIONALTALENT name="Durability"/>
		<OPTIONALTALENT name="Lasting Impression"/>
		<OPTIONALTALENT name="Rapid Strike"/>
		<OPTIONALTALENT name="Tiger Spring"/>
		<OPTIONALTALENT name="Winning Smile"/>
		<DISCIPLINETALENT name="Cross"/>
		<TALENTABILITY/>
		<DEFENSE kind="physical"/>
	</CIRCLE>
	<CIRCLE><!-- 3 -->
		<DISCIPLINETALENT name="Hook"/>
		<TALENTABILITY/>
	</CIRCLE>
	<CIRCLE><!-- 4 -->
		<DISCIPLINETALENT name="Thread Weaving" limitation="Fist Weaving"/>
		<TALENTABILITY/>
		<KARMA spend="Dexterity-only Test"/>
	</CIRCLE>
	<CIRCLE><!-- 5 -->
		<OPTIONALTALENT name="Anticipate Blow"/>
		<OPTIONALTALENT name="Engaging Dance"/>
		<OPTIONALTALENT name="Graceful Exit"/>
		<OPTIONALTALENT name="Lion Heart"/>
		<OPTIONALTALENT name="Momentum Attack"/>
		<OPTIONALTALENT name="Resist Taunt"/>
		<OPTIONALTALENT name="Steely Stare"/>
		<OPTIONALTALENT name="Taunt"/>
		<DISCIPLINETALENT name="Combo"/>
		<TALENTABILITY/>
		<ABILITY>Find Opening</ABILITY>
	</CIRCLE>
	<CIRCLE><!-- 6 -->
		<DISCIPLINETALENT name="Uppercut"/>
		<TALENTABILITY/>
		<KARMA spend="Charisma-only Test"/>
	</CIRCLE>
	<CIRCLE><!-- 7 -->
		<DISCIPLINETALENT name="Lightning Combo"/>
		<TALENTABILITY/>
		<KARMA spend="unarmed Damage Tests"/>
	</CIRCLE>
	<CIRCLE><!-- 8 -->
		<DISCIPLINETALENT name="Temper Self"/>
		<TALENTABILITY/>
		<DEFENSE kind="physical"/>
	</CIRCLE>
		<CIRCLE><!-- 9 -->
		<OPTIONALTALENT name="Bedazzle"/>
		<OPTIONALTALENT name="Cobra Strike"/>
		<OPTIONALTALENT name="Critical Hit"/>
		<OPTIONALTALENT name="Incite Mob"/>
		<OPTIONALTALENT name="Life Check"/>
		<OPTIONALTALENT name="Pin"/>
		<OPTIONALTALENT name="Steel Thought"/>
		<OPTIONALTALENT name="Vitality"/>
		<DISCIPLINETALENT name="Champion Challenge"/>
		<TALENTABILITY/>
		<KARMA spend="Recovery Test"/>
		<ABILITY>Break</ABILITY>
	</CIRCLE>
	<CIRCLE><!-- 10 -->
		<DISCIPLINETALENT name="Absorb Blow"/>
		<TALENTABILITY/>
		<DEFENSE kind="physical"/>
		<KARMA spend="Strength-only Test"/>
	</CIRCLE>
	<CIRCLE><!-- 11 -->
		<DISCIPLINETALENT name="Impressive Strike"/>
		<TALENTABILITY/>
		<DEFENSE kind="social"/>
		<DEFENSE kind="mystic"/>
	</CIRCLE>
	<CIRCLE><!-- 12 -->
		<DISCIPLINETALENT name="Knockout"/>
		<TALENTABILITY/>
		<DEFENSE kind="physical"/>
		<INITIATIVE/>
	</CIRCLE>
	<CIRCLE><!-- 13 -->
		<OPTIONALTALENT name="Bardic Voice"/>
		<OPTIONALTALENT name="Lion Spirit"/>
		<OPTIONALTALENT name="Phantom Strike"/>
		<OPTIONALTALENT name="Resist Pain"/>
		<OPTIONALTALENT name="Second Chance"/>
		<OPTIONALTALENT name="Spirit Strike"/>
		<DISCIPLINETALENT name="Vital Strike"/>
		<TALENTABILITY/>
		<DEFENSE kind="social"/>
		<KARMASTEP/>
		<ABILITY>Superior Footwork</ABILITY>
	</CIRCLE>
	<CIRCLE><!-- 14 -->
		<DISCIPLINETALENT name="Multi-Strike"/>
		<TALENTABILITY/>
		<DEFENSE kind="physical"/>
	</CIRCLE>
	<CIRCLE><!-- 15 -->
		<DISCIPLINETALENT name="Aura Armor"/>
		<TALENTABILITY/>
		<DEFENSE kind="social"/>
		<DEFENSE kind="mystic"/>
	</CIRCLE>
	<KARMARITUAL>Please insert a short description of your Karma Ritual. It have to last for 30 minutes</KARMARITUAL>
	<HALFMAGIC>knowledge: physical fitness, tests to find/ set up bout in town/ city, customs regarding conduction of bout; Perception-based Tests: Pugilists they observe fighting determine his style and teacher;(CPG p.53)</HALFMAGIC>
</DISCIPLINE>
